{
  "company_name": "Stadium",
  "company_slug": "stadium",
  "generated_at": "2026-02-17T11:09:19.021160",
  "brand_identity": {
    "positioning": "Koko kansan liikuttaja ja Active Lifestyle -br\u00e4ndi. Missio on aktivoida maailmaa matalan kynnyksen energisen\u00e4 mahdollistajana.",
    "visual_markers": {
      "primary_color": "Kirkkaat br\u00e4ndiv\u00e4rit",
      "secondary_colors": [
        "Sesonkiv\u00e4rit"
      ],
      "style_keywords": [
        "Puhdas pohjoismainen",
        "Ryhm\u00e4ss\u00e4 tekeminen",
        "Valoisa",
        "Kutsuva"
      ],
      "tone_keywords": [
        "Energinen",
        "Kannustava",
        "Mutkaton",
        "Inklusiivinen"
      ]
    },
    "voice_characteristics": [
      "Valmentaja (Coach)",
      "Tsemppaava",
      "Rinnalla kulkeva",
      "Join the Movement"
    ]
  },
  "strategic_priorities": [
    {
      "rank": 1,
      "priority": "Omat tuotemerkit (erityisesti SOC)",
      "evidence": [
        "SOC-tuotteiden dominanssi myym\u00e4l\u00f6iden ja verkkokaupan paraatipaikoilla",
        "Strateginen tarve kilpailla verkkokauppaj\u00e4ttej\u00e4 vastaan paremmilla katteilla"
      ],
      "execution_assessment": "strong"
    },
    {
      "rank": 2,
      "priority": "Vastuullisuus ja Kiertotalous",
      "evidence": [
        "Re:activate -konsepti (k\u00e4ytettyjen v\u00e4lineiden ker\u00e4ys)",
        "Human Rights -raportointi ja kest\u00e4v\u00e4t materiaalit SOC-mallistossa"
      ],
      "execution_assessment": "moderate"
    },
    {
      "rank": 3,
      "priority": "Omnichannel & Digitaalinen Asiakaskokemus",
      "evidence": [
        "Investoinnit verkkokauppa-alustaan",
        "Kanta-asiakasohjelman digitalisointi ja Click & Collect -logistiikka"
      ],
      "execution_assessment": "strong"
    }
  ],
  "marketing_posture": {
    "current_content_types": [
      "Taktinen ja syklinen sesonkimainonta",
      "Korkean tuotantoarvon TV-mainokset (fiilis)",
      "Hintavetoiset mainokset",
      "Geneerinen outfit-sis\u00e4lt\u00f6"
    ],
    "channel_presence": {
      "youtube": {
        "active": false,
        "assessment": "Passiivinen/Heikko. Toimii TV-mainosten arkistona. Ei hy\u00f6dynnet\u00e4 hakua tai opastusta."
      },
      "tiktok": {
        "active": true,
        "assessment": "Aktiivinen. Visuaalisesti tyylik\u00e4st\u00e4, mutta geneerist\u00e4 sis\u00e4lt\u00f6\u00e4."
      },
      "instagram": {
        "active": true,
        "assessment": "Aktiivinen. Visuaalisesti tyylik\u00e4st\u00e4, mutta geneerist\u00e4 sis\u00e4lt\u00f6\u00e4. Vaikuttajayhteisty\u00f6t pinnallisia."
      },
      "linkedin": {
        "active": false,
        "assessment": "Ei analysoitu l\u00e4hdemateriaalissa."
      }
    },
    "apparent_gaps": [
      "Hy\u00f6tytieto puuttuu (How-to -sis\u00e4lt\u00f6)",
      "Tarinankerronta puuttuu (sponsoroinnin tunne ei siirry digiin)"
    ],
    "audience_engagement": "Fyysisiss\u00e4 tapahtumissa sitoutuminen on vahvaa, mutta digitaalisesti suhde on transaktionaalinen."
  },
  "competitive_analysis": {
    "key_competitors": [
      {
        "name": "XXL",
        "content_strategy": "Aggressiivinen hintaviestint\u00e4, kaikki urheiluun -katalogimaisuus",
        "threat_level": "high"
      },
      {
        "name": "Intersport",
        "content_strategy": "Asiantuntijuuden korostaminen (huolto, analyysit)",
        "threat_level": "medium"
      },
      {
        "name": "Muotitalot (H&M Move, Zara) & DTC (Nike, Adidas)",
        "content_strategy": "Lifestyle-vetoinen athleisure ja suora asiakassuhde sovelluksissa",
        "threat_level": "medium"
      }
    ],
    "brand_winning_areas": [
      "Saavutettavuus ja matala kynnys (Active Lifestyle)",
      "Oman merkin (SOC) hinta-laatusuhde",
      "Lasten ja nuorten liikunnan tukeminen"
    ],
    "brand_losing_areas": [
      "Syv\u00e4llinen asiantuntijamielikuva",
      "Digitaalinen tarinankerronta ja yhteis\u00f6llisyys",
      "Opastavan sis\u00e4ll\u00f6n puute"
    ]
  },
  "strategic_tensions": [
    {
      "id": "tension_01",
      "description": "Missio vs. Sis\u00e4lt\u00f6 (Inspiraatiovaje): Missio on aktivoida, mutta sis\u00e4lt\u00f6 on tuote-esittely\u00e4.",
      "evidence": [
        "Slogan 'Join the Movement' lupaa toimintaa",
        "Kanavat t\u00e4ynn\u00e4 tuotekuvia, ei treenivinkkej\u00e4"
      ],
      "opportunity_type": "gap",
      "priority_score": 5
    },
    {
      "id": "tension_02",
      "description": "Ruohonjuuritason tunne vs. Digitaalinen et\u00e4isyys: Aito tunne kent\u00e4n laidalta ei siirry digiin.",
      "evidence": [
        "Vahva panostus Helsinki Cupiin ja Vasaloppetiin",
        "Digitaalinen sis\u00e4lt\u00f6 on studiokuvattua ja geneerist\u00e4"
      ],
      "opportunity_type": "aspiration",
      "priority_score": 4
    },
    {
      "id": "tension_03",
      "description": "Vastuullisuusjohtajuus vs. Volyymibisnes (SOC): Halutaan olla vastuullisia, mutta ydin on volyymimyynti.",
      "evidence": [
        "Raportit korostavat kest\u00e4vyytt\u00e4",
        "Myym\u00e4l\u00e4t dominoidaan edullisilla SOC-tuotteilla (pikamuoti-mielikuva)"
      ],
      "opportunity_type": "threat",
      "priority_score": 4
    },
    {
      "id": "tension_04",
      "description": "Palvelun tarve vs. Sis\u00e4ll\u00f6n puute: Asiakkaat hakevat tietoa, Stadium ei tarjoa sit\u00e4.",
      "evidence": [
        "Google-haut osoittavat kysynn\u00e4n how-to -tiedolle",
        "Liikenne valuu kilpailijoille tai tubettajille"
      ],
      "opportunity_type": "underserved_audience",
      "priority_score": 3
    }
  ],
  "opportunity_zones": [
    {
      "id": "opp_01",
      "description": "Active Life Coach - Hy\u00f6tytieto ja opastus",
      "rationale": "T\u00e4ytt\u00e4\u00e4 strategisen aukon, rakentaa asiantuntijuutta ja hy\u00f6dynt\u00e4\u00e4 YouTubea hakukoneena.",
      "risk_level": "low"
    },
    {
      "id": "opp_02",
      "description": "Local Heroes - Aidot tarinat kent\u00e4n laidalta",
      "rationale": "Ratkaisee j\u00e4nnitteen fyysisen ja digitaalisen v\u00e4lill\u00e4, tuo br\u00e4ndille sielua.",
      "risk_level": "medium"
    },
    {
      "id": "opp_03",
      "description": "SOC-br\u00e4ndin arvonkorotus (Brand Elevation)",
      "rationale": "Ratkaisee j\u00e4nnitett\u00e4 vastuullisuuden ja halpatuotannon v\u00e4lill\u00e4, nostaa SOC:n smart choice -kategoriaan.",
      "risk_level": "medium"
    }
  ],
  "sources": [
    {
      "title": "Stadium AB Sustainability Reports (2023-2024)",
      "url": "N/A",
      "type": "report",
      "date_accessed": "2024-01-01",
      "relevance": "Vastuullisuusstrategia ja tavoitteet."
    },
    {
      "title": "Stadium.fi & Stadium.se",
      "url": "https://www.stadium.fi",
      "type": "company_site",
      "date_accessed": "2024-01-01",
      "relevance": "Kampanjat, missio, About Us, SOC-valikoima."
    },
    {
      "title": "Stadium YouTube Channel Audit",
      "url": "https://www.youtube.com/user/stadium",
      "type": "video",
      "date_accessed": "2024-01-01",
      "relevance": "Nykyisen videostrategian puutteiden analyysi."
    },
    {
      "title": "Lehdist\u00f6tiedotteet (Stadium Press Room)",
      "url": "N/A",
      "type": "news",
      "date_accessed": "2024-01-01",
      "relevance": "Yhteisty\u00f6sopimukset (Helsinki Cup, Vasaloppet)."
    },
    {
      "title": "Markkina-analyysi (Kaupan liitto & Urheilukauppa ry tilastot)",
      "url": "N/A",
      "type": "report",
      "date_accessed": "2024-01-01",
      "relevance": "Yleiset markkinatrendit ja kilpailutilanne."
    }
  ]
}