{
  "company_name": "Volvo Personal Service",
  "company_slug": "volvo-personal-service",
  "generated_at": "2026-02-23T11:34:42.067164",
  "brand_identity": {
    "positioning": "Sinä ja autosi ansaitsette henkilökohtaista palvelua. Lean-filosofiaan perustuva prosessi, jossa välikädet on poistettu ja asiakas on suorassa kontaktissa Omamekaanikkoon.",
    "visual_markers": {
      "primary_color": "Skandinaavinen puhtaus (Cool tones)",
      "secondary_colors": [
        "Lasi",
        "Puu (olohuonemainen)"
      ],
      "style_keywords": [
        "Skandinaavinen",
        "Tekninen",
        "Kliininen",
        "Ihmisläheinen (pyrkimys)"
      ],
      "tone_keywords": [
        "Asiallinen",
        "Suora",
        "Pohjoismainen",
        "Premium"
      ]
    },
    "voice_characteristics": [
      "Cool on the outside, warm on the inside",
      "Asiallinen",
      "Suora"
    ]
  },
  "strategic_priorities": [
    {
      "rank": 1,
      "priority": "Sähköistymisen hallinta (Electrification Transition)",
      "evidence": [
        "Fokus EX90/EX30-malleissa",
        "Huollon roolin muutos: mekaanisesta ohjelmistopäivityksiin (OTA) ja akkuteknologiaan"
      ],
      "execution_assessment": "moderate"
    },
    {
      "rank": 2,
      "priority": "Asiakasito (Retention) & Vanhempi autokanta",
      "evidence": [
        "Volvo Essential -huolto (yli 6-vuotiaat autot)",
        "Tavoite estää asiakasvuoto riippumattomille ketjuille"
      ],
      "execution_assessment": "moderate"
    },
    {
      "rank": 3,
      "priority": "Digitalisaatio (Digital Customer Journey)",
      "evidence": [
        "Volvo Cars App asiakassuhteen kaukosäätimenä",
        "Huollon varaus ja hallinta keskitetty appiin"
      ],
      "execution_assessment": "strong"
    },
    {
      "rank": 4,
      "priority": "Kestävä kehitys (Sustainability / Circular Economy)",
      "evidence": [
        "Tavoite olla ilmastoneutraali 2040",
        "Osien korjaaminen vaihtamisen sijaan (esim. lasit, puskurit)"
      ],
      "execution_assessment": "moderate"
    }
  ],
  "marketing_posture": {
    "current_content_types": [
      "Global Brand (Tunteikkaat TV-mainokset)",
      "Local Tactical (Sähköposti ja bannerit)",
      "Social (Tapahtumakoosteet ja lanseeraukset)"
    ],
    "channel_presence": {
      "youtube": {
        "active": true,
        "assessment": "Aktiivinen (globaali materiaali), mutta heikko hyötytiedon osalta."
      },
      "tiktok": {
        "active": false,
        "assessment": "Ei mainittu aineistossa."
      },
      "instagram": {
        "active": true,
        "assessment": "Visuaalisesti korkeatasoinen, mutta etäinen."
      },
      "linkedin": {
        "active": false,
        "assessment": "Ei mainittu aineistossa."
      }
    },
    "apparent_gaps": [
      "Inhimillisyysvaje: Sisällöstä puuttuu Omamekaanikon kasvot ja ääni.",
      "Hyötytietotyhjiö: Puuttuu How-to -sisältö (esim. latausvinkit, pyyhkijät)."
    ],
    "audience_engagement": "Brändisisältöä arvostetaan, mutta käytännön ongelmissa yleisö kääntyy kilpailijoiden (Vianor, Autodoc) puoleen."
  },
  "competitive_analysis": {
    "key_competitors": [
      {
        "name": "K-Auto (VW/Audi)",
        "content_strategy": "MyDay-videosarja inhimillistää mekaanikon työn; selkeät opasvideot.",
        "threat_level": "high"
      },
      {
        "name": "Vianor & Rengasketjut",
        "content_strategy": "Asiantuntijan rooli hakukoneissa ja YouTubessa (esim. rengasrikkovinkit).",
        "threat_level": "medium"
      },
      {
        "name": "Autodoc",
        "content_strategy": "Massiivinen määrä DIY-sisältöä ja varaosamyyntiä.",
        "threat_level": "medium"
      }
    ],
    "brand_winning_areas": [
      "Premium-mielikuva",
      "Turvallisuusperintö",
      "Omamekaanikko-konseptin lupaus"
    ],
    "brand_losing_areas": [
      "Käytännönläheisyys",
      "Digitaalinen lähestyttävyys",
      "Asiantuntijuuden konkreettinen näyttäminen (likaiset kädet)"
    ]
  },
  "strategic_tensions": [
    {
      "id": "tension_01",
      "description": "Volvo lupaa henkilökohtaisen Omamekaanikon, mutta digitaalinen asiakaspolku (App) eristää asiakkaan ihmiskontaktista.",
      "evidence": [
        "Markkinointi korostaa PST-henkilöä, mutta prosessi ohjaa appiin.",
        "Videosisällöstä puuttuu mekaanikon kasvot."
      ],
      "opportunity_type": "gap",
      "priority_score": 5
    },
    {
      "id": "tension_02",
      "description": "Brändi haluaa ylläpitää virheetöntä Premium-kuvaa, mikä estää näyttämästä huollon vaatimaa fyysistä asiantuntemusta.",
      "evidence": [
        "Visuaalisuus on kliinistä ja muotilehtimäistä.",
        "Kilpailijat (K-Auto) näyttävät aitoa työtä ja rakentavat luottamusta."
      ],
      "opportunity_type": "aspiration",
      "priority_score": 4
    },
    {
      "id": "tension_03",
      "description": "Volvo omistaa turvallisuuden, mutta on ulkoistanut turvallisuuskriittisen ylläpitovalistuksen (renkaat, näkyvyys) rengasliikkeille.",
      "evidence": [
        "Kanavista puuttuu 'Näin pidät autosi turvallisena' -hyötytieto.",
        "Haut valuvat Vianorille ja Autodocille."
      ],
      "opportunity_type": "threat",
      "priority_score": 4
    }
  ],
  "opportunity_zones": [
    {
      "id": "opp_01",
      "description": "Demokratisoitu asiantuntijuus (Pro Tips)",
      "rationale": "Ratkaisee uskottavuusongelman ja palauttaa asiantuntijuusjohtajuuden Volvolle näyttämällä osaamisen konkreettisesti.",
      "risk_level": "low"
    },
    {
      "id": "opp_02",
      "description": "Sähköautoilun uusi lukutaito",
      "rationale": "Vastaa sähköautoilijoiden epävarmuuteen ja sitouttaa uudet asiakkaat brändiin huollon kautta.",
      "risk_level": "medium"
    },
    {
      "id": "opp_03",
      "description": "Digitaalinen Omamekaanikko",
      "rationale": "Inhimillistää digitaalisen muurin ja tekee brändistä lähestyttävän ennen fyysistä kohtaamista.",
      "risk_level": "medium"
    }
  ],
  "sources": [
    {
      "title": "k-auto.fi",
      "url": "https://www.k-auto.fi/",
      "type": "company_site",
      "date_accessed": "2026-02-23",
      "relevance": "Kilpailija-analyysi"
    },
    {
      "title": "modash.io",
      "url": "N/A",
      "type": "other",
      "date_accessed": "2026-02-23",
      "relevance": "Influencer/Social data"
    },
    {
      "title": "comparably.com",
      "url": "N/A",
      "type": "other",
      "date_accessed": "2026-02-23",
      "relevance": "Brand comparison"
    },
    {
      "title": "youtube.com (Volvo Car Finland & Global)",
      "url": "N/A",
      "type": "social",
      "date_accessed": "2026-02-23",
      "relevance": "Sisältöauditointi"
    },
    {
      "title": "inside-outmedia.com",
      "url": "N/A",
      "type": "report",
      "date_accessed": "2026-02-23",
      "relevance": "Trend analysis"
    },
    {
      "title": "reddit.com (r/Volvo & r/MechanicAdvice)",
      "url": "N/A",
      "type": "social",
      "date_accessed": "2026-02-23",
      "relevance": "Asiakasymmärrys/keskustelut"
    },
    {
      "title": "hireborderless.com",
      "url": "N/A",
      "type": "report",
      "date_accessed": "2026-02-23",
      "relevance": "Industry trends"
    },
    {
      "title": "autodoc.fi",
      "url": "https://www.autodoc.fi/",
      "type": "company_site",
      "date_accessed": "2026-02-23",
      "relevance": "Kilpailija-analyysi (DIY)"
    }
  ]
}