{
  "company_name": "Bolt taksipalvelu",
  "company_slug": "bolt-taksipalvelu",
  "generated_at": "2026-04-29T10:28:13.514165",
  "brand_identity": {
    "positioning": "Euroopan ensimmäiseksi liikkumisen super-apiksi. Brändin ydinlupaus rakentuu yksityisautoilun vastustamiselle ja parempien kaupunkien rakentamiselle tarjoamalla kätevämpiä ja fiksumpia vaihtoehtoja auton omistamiselle.",
    "visual_markers": {
      "primary_color": "Vihreä",
      "secondary_colors": [
        "Keltainen"
      ],
      "style_keywords": [
        "Moderni",
        "Pelkistetty",
        "Nopea",
        "Sähköinen",
        "Monipuolinen"
      ],
      "tone_keywords": [
        "Leikkisä",
        "Terävä",
        "Oivaltava",
        "Inhimillinen",
        "Puolustuskannalla",
        "Sääntelyä vastustava"
      ]
    },
    "voice_characteristics": [
      "Leikkisä",
      "Terävä",
      "Oivaltava",
      "Inhimillinen kansainvälisesti",
      "Puolustuskannalla paikallisesti"
    ]
  },
  "strategic_priorities": [
    {
      "rank": 1,
      "priority": "Kannattavuus ja pörssilistautuminen (IPO)",
      "evidence": [
        "Toimitusjohtaja Markus Villigin lausunnot siirtymisestä hyperkasvusta ja rahan 'polttamisesta' kohti kannattavuutta.",
        "Tavoitteena listautuminen 2025–2026.",
        "Kulujen leikkaaminen."
      ],
      "execution_assessment": "strong"
    },
    {
      "rank": 2,
      "priority": "Sääntelyn vastustaminen ja matalat kynnykset",
      "evidence": [
        "Aktiivinen lobbaus perinteistä taksisääntelyä vastaan.",
        "Suomessa maajohtajan julkinen vastustus taksamittaripakkoa, värillisiä rekisterikilpiä ja kielitaitovaatimuksia kohtaan."
      ],
      "execution_assessment": "strong"
    },
    {
      "rank": 3,
      "priority": "Mikroliikkumisen ja super-appin yhdistäminen",
      "evidence": [
        "Käyttäjien aktiivinen ohjaaminen lyhyillä matkoilla autoista sähköpotkulautoihin saman sovelluksen sisällä."
      ],
      "execution_assessment": "moderate"
    },
    {
      "rank": 4,
      "priority": "Automaatio tulevaisuuden skaalaajana",
      "evidence": [
        "Tutkimusyhteistyö itseajavien autojen parissa.",
        "Johdon visio liiketoiminnan 10–100-kertaistamisesta automaation avulla."
      ],
      "execution_assessment": "weak"
    }
  ],
  "marketing_posture": {
    "current_content_types": [
      "Taktinen suorituskykymarkkinointi",
      "Suuret brändilliset OOH- ja printtikampanjat",
      "PR-viestintä ja tutkimusjulkaisut",
      "Liikkuva ulkomainonta"
    ],
    "channel_presence": {
      "tiktok": {
        "active": true,
        "assessment": "Hyödyntää koneoppimiseen perustuvia Smart Performance -kampanjoita uusien latausten generointiin. Korkea taktinen laatu."
      },
      "snapchat": {
        "active": true,
        "assessment": "Käyttää 'full-funnel' -strategiaa lokaalien julkkiksien ja vaikuttajien avulla."
      },
      "youtube": {
        "active": false,
        "assessment": "Ei eritelty aineistossa."
      },
      "instagram": {
        "active": false,
        "assessment": "Ei eritelty aineistossa, mutta brändi nojaa vahvasti nuorten suosimiin lyhytvideokanaviin."
      },
      "linkedin": {
        "active": false,
        "assessment": "Ei eritelty aineistossa."
      }
    },
    "apparent_gaps": [
      "Digitaalisesta strategiasta puuttuu inhimillistävä, luottamusta rakentava sisältö.",
      "Markkinointi on jakautunut liian jyrkästi joko ylätason brändikuviin tai puhtaaseen algoritmi-optimointiin."
    ],
    "audience_engagement": "Voimakkaan polarisoitunut. Yleisö sitoutuu erinomaisesti hintaan ja helppouteen (sovelluksen käyttö), mutta orgaaninen keskustelu on erittäin negatiivista keskittyen peruttuihin kyyteihin, kielimuuriin ja turvattomuuden tunteeseen."
  },
  "competitive_analysis": {
    "key_competitors": [
      {
        "name": "Uber",
        "content_strategy": "Rakentaa globaalia, hieman premium-tason mielikuvaa.",
        "threat_level": "high"
      },
      {
        "name": "Taksi Helsinki / Lähitaksi",
        "content_strategy": "Korostavat luotettavuutta, paikallistuntemusta, turvallisuutta ja ammattitaitoa. Hyökkäävät aktiivisesti Boltin 'halpuus edellä' -mallia vastaan.",
        "threat_level": "high"
      }
    ],
    "brand_winning_areas": [
      "Hinta (30–40 % halvempi)",
      "Digitaalinen helppokäyttöisyys",
      "Kiinteä ennakkohinta",
      "Nuoret aikuiset",
      "Yöelämän siirtymät"
    ],
    "brand_losing_areas": [
      "Inhimillinen luotettavuus",
      "Laatumielikuva",
      "B2B-asiakkaat",
      "Pakolliset matkat (esim. lentokenttä)",
      "Kuljettajien ammattitaidon ja työolojen maine"
    ]
  },
  "strategic_tensions": [
    {
      "id": "tension_01",
      "description": "Brändi viestii olevansa vihreä, parempia kaupunkeja rakentava teknologiayritys, mutta todellisuudessa ydinliiketoiminta nojaa polttomoottoriautoilla ajavaan, matalapalkkaiseen keikkatyövoimaan.",
      "evidence": [
        "Ydinviesti: 'Tech for Good' ja yksityisautoilun vastustaminen.",
        "Todellisuus: Kuljettajat tekevät jopa 16 tunnin päiviä matalalla katteella.",
        "Palvelu mielletään halvimmaksi kyydiksi, ei ekologiseksi arvovalinnaksi."
      ],
      "opportunity_type": "aspiration",
      "priority_score": 4
    },
    {
      "id": "tension_02",
      "description": "Sovellus tarjoaa saumattoman teknologisen kokemuksen, mutta ei pysty takaamaan inhimillistä luotettavuutta katutasolla.",
      "evidence": [
        "Käyttäjät pitävät sovellusta helppona, mutta kärsivät 'bolttaamisesta' (viime hetken peruutukset).",
        "Asiakkaat vaihtavat kalliimpaan kilpailijaan silloin, kun kyydin on pakko onnistua (esim. lentokenttämatkat)."
      ],
      "opportunity_type": "gap",
      "priority_score": 5
    },
    {
      "id": "tension_03",
      "description": "Yhtiö lupaa asiakkaille halpoja hintoja, mutta pörssilistautumisen (IPO) vaatima kulukuri tuhoaa palvelun laadun.",
      "evidence": [
        "Yhtiö on leikannut kulujaan rajusti saavuttaakseen kannattavuuden.",
        "Kuluttajakeskusteluissa toistuvat autojen heikko siisteystaso ja kuljettajien puutteellinen paikallistuntemus."
      ],
      "opportunity_type": "threat",
      "priority_score": 5
    },
    {
      "id": "tension_04",
      "description": "Kansainvälisesti Bolt on älykäs vaihtoehto auton omistamiselle, mutta paikallisesti (Suomessa) se on profiloitunut sääntelyä vastustavaksi 'villiksi länneksi'.",
      "evidence": [
        "Kansainvälinen kampanja: 'Why Drive When You Can Ride?'",
        "Paikallinen toiminta: Lobbaus taksamittareita ja kielitaitovaatimuksia vastaan, mikä romuttaa laatumielikuvaa."
      ],
      "opportunity_type": "gap",
      "priority_score": 3
    }
  ],
  "opportunity_zones": [
    {
      "id": "opp_01",
      "description": "Algoritmin inhimillistäminen.",
      "rationale": "Boltin suurin heikkous on kasvottomuus ja luottamuspula. Koska luottamus syntyy ihmisten välillä, brändin tulisi siirtää sisältöfokus applikaation käyttöliittymästä takapenkin ja etupenkin väliseen inhimilliseen kohtaamiseen. Tämä paikkaa kuilua teknologian ja katutason todellisuuden välillä.",
      "risk_level": "low"
    },
    {
      "id": "opp_02",
      "description": "Laatumielikuvan korjaaminen ilman hintalappua.",
      "rationale": "Bolt ei voi muuttua premium-brändiksi menettämättä kilpailuetuaan (hinta), mutta sen on vastattava kilpailijoiden turvallisuusargumentteihin. On löydettävä luova tapa visualisoida ja viestiä, että 'edullinen ei tarkoita turvatonta', rakentaen brändiarvoa pelkän hinnan rinnalle.",
      "risk_level": "medium"
    },
    {
      "id": "opp_03",
      "description": "Paikallisuuden haltuunotto ja käyttökontekstin laajentaminen.",
      "rationale": "Bolt nähdään kasvottomana kansainvälisenä jättinä ja pelkkänä 'baarikyytinä'. Luomalla sisältöä, joka osoittaa syvää ymmärrystä paikallisesta kulttuurista, sääolosuhteista ja arjen sujuvasta liikkumisesta, brändi voi irtautua yöelämäkontekstista ja lunastaa lupauksensa arjen 'super-appina'.",
      "risk_level": "low"
    }
  ],
  "sources": [
    {
      "title": "Trustpilot",
      "url": "trustpilot.com",
      "type": "social",
      "date_accessed": "2024-05-20",
      "relevance": "Kuluttajapalautteet ja luottamuksen arviointi."
    },
    {
      "title": "Medium",
      "url": "medium.com",
      "type": "other",
      "date_accessed": "2024-05-20",
      "relevance": "Strategiset analyysit ja brändipositiointi."
    },
    {
      "title": "Sifted",
      "url": "sifted.eu",
      "type": "news",
      "date_accessed": "2024-05-20",
      "relevance": "IPO-valmistelut, kannattavuus ja toimitusjohtajan lausunnot."
    },
    {
      "title": "Autotoday",
      "url": "autotoday.fi",
      "type": "news",
      "date_accessed": "2024-05-20",
      "relevance": "Paikallinen taksimarkkina ja sääntely Suomessa."
    },
    {
      "title": "TikTok",
      "url": "tiktok.com",
      "type": "social",
      "date_accessed": "2024-05-20",
      "relevance": "Suorituskykymarkkinointi ja nuorten kohderyhmien tavoittaminen."
    },
    {
      "title": "Reddit",
      "url": "reddit.com",
      "type": "social",
      "date_accessed": "2024-05-20",
      "relevance": "Orgaaninen kuluttajakeskustelu, 'bolttaaminen' ja laatuongelmat."
    }
  ]
}